A1: Range (bits) | B1: float_sort | C1: std::sort | D1: 1E7 elements
A2: 0 | B2: 6.2E-2 | C2: 2.5000000000000001E-2
A3: =A2+1 -> 1 | B3: 0.29199999999999998 | C3: 0.11899999999999999
A4: =A3+1 -> 2 | B4: 0.28599999999999998 | C4: 0.184
A5: =A4+1 -> 3 | B5: 0.27400000000000002 | C5: 0.26
A6: =A5+1 -> 4 | B6: 0.26700000000000002 | C6: 0.34100000000000003
A7: =A6+1 -> 5 | B7: 0.29099999999999998 | C7: 0.41399999999999998
A8: =A7+1 -> 6 | B8: 0.309 | C8: 0.54100000000000004
A9: =A8+1 -> 7 | B9: 0.29399999999999998 | C9: 0.59299999999999997
A10: =A9+1 -> 8 | B10: 0.32700000000000001 | C10: 0.73199999999999998
A11: =A10+1 -> 9 | B11: 0.373 | C11: 0.85
A12: =A11+1 -> 10 | B12: 0.46800000000000003 | C12: 0.91900000000000004
A13: =A12+1 -> 11 | B13: 0.5 | C13: 1.0289999999999999
A14: =A13+1 -> 12 | B14: 0.52600000000000002 | C14: 1.0640000000000001
A15: =A14+1 -> 13 | B15: 0.79800000000000004 | C15: 1.2709999999999999
A16: =A15+1 -> 14 | B16: 0.72699999999999998 | C16: 1.2789999999999999
A17: =A16+1 -> 15 | B17: 0.73599999999999999 | C17: 1.4339999999999999
A18: =A17+1 -> 16 | B18: 0.77700000000000002 | C18: 1.4370000000000001
A19: =A18+1 -> 17 | B19: 0.73699999999999999 | C19: 1.5620000000000001
A20: =A19+1 -> 18 | B20: 0.73599999999999999 | C20: 1.6639999999999999
A21: =A20+1 -> 19 | B21: 0.72499999999999998 | C21: 1.8140000000000001
A22: =A21+1 -> 20 | B22: 0.74 | C22: 1.954
A23: =A22+1 -> 21 | B23: 0.76600000000000001 | C23: 2.0219999999999998
A24: =A23+1 -> 22 | B24: 0.874 | C24: 2.1989999999999998
A25: =A24+1 -> 23 | B25: 1.0880000000000001 | C25: 2.1120000000000001
A26: =A25+1 -> 24 | B26: 1.377 | C26: 2.1560000000000001
A27: =A26+1 -> 25 | B27: 1.1839999999999999 | C27: 2.2469999999999999
A28: =A27+1 -> 26 | B28: 1.09 | C28: 2.1459999999999999
A29: =A28+1 -> 27 | B29: 0.96199999999999997 | C29: 2.2690000000000001
A30: =A29+1 -> 28 | B30: 0.98199999999999998 | C30: 2.165
A31: =A30+1 -> 29 | B31: 1.026 | C31: 2.2759999999999998
A32: =A31+1 -> 30 | B32: 1.202 | C32: 2.1349999999999998
A33: =A32+1 -> 31 | B33: 1.1930000000000001 | C33: 2.2589999999999999
A34: =A33+1 -> 32 | B34: 1.1819999999999999 | C34: 2.2389999999999999