A1: Element Count | B1: float_sort | C1: std::sort
A2: 4000 | B2: 2.41E-4 | C2: 4.4000000000000002E-4
A3: =A2*2 -> 8000 | B3: 5.0799999999999999E-4 | C3: 9.68E-4
A4: =A3*2 -> 16000 | B4: 1.0250000000000001E-3 | C4: 2.1299999999999999E-3
A5: =A4*2 -> 32000 | B5: 2.14E-3 | C5: 4.6100000000000004E-3
A6: =A5*2 -> 64000 | B6: 4.9199999999999999E-3 | C6: 9.4999999999999998E-3
A7: =A6*2 -> 128000 | B7: 1.5049999999999999E-2 | C7: 2.0799999999999999E-2
A8: =A7*2 -> 256000 | B8: 2.6599999999999999E-2 | C8: 4.3400000000000001E-2
A9: =A8*2 -> 512000 | B9: 5.74E-2 | C9: 9.1800000000000007E-2
A10: =A9*2 -> 1024000 | B10: 0.1255 | C10: 0.1915
A11: =A10*2 -> 2048000 | B11: 0.28199999999999997 | C11: 0.39700000000000002
A12: =A11*2 -> 4096000 | B12: 0.60399999999999998 | C12: 0.83399999999999996
A13: =A12*2 -> 8192000 | B13: 1.2629999999999999 | C13: 1.752
A14: =A13*2 -> 16384000 | B14: 1.732 | C14: 3.766
A15: =A14*2 -> 32768000 | B15: 3.5310000000000001 | C15: 7.548
A16: =A15*2 -> 65536000 | B16: 7.2510000000000003 | C16: 15.632999999999999