A1: Element Count | B1: string_sort | C1: std::sort
A2: 32000 | B2: 1.4999999999999999E-2 | C2: 1.4999999999999999E-2
A3: =A2*2 -> 64000 | B3: 3.1E-2 | C3: 4.7E-2
A4: =A3*2 -> 128000 | B4: 4.7E-2 | C4: 6.2E-2
A5: =A4*2 -> 256000 | B5: 6.2E-2 | C5: 9.4E-2
A6: =A5*2 -> 512000 | B6: 7.8E-2 | C6: 0.187
A7: =A6*2 -> 1024000 | B7: 9.4E-2 | C7: 0.40500000000000003
A8: =A7*2 -> 2048000 | B8: 0.28100000000000003 | C8: 0.85799999999999998
A9: =A8*2 -> 4096000 | B9: 0.78 | C9: 1.8260000000000001
A10: =A9*2 -> 8192000 | B10: 1.84 | C10: 4.024
A11: =A10*2 -> 16384000 | B11: 4.165 | C11: 8.6110000000000007
A12: =A11*2 -> 32768000 | B12: 8.5169999999999995 | C12: 17.315999999999999
A13: =A12*2 -> 65536000 | B13: 13.26 | C13: 38.125999999999998