A1: Element Count | B1: string_sort | C1: std::sort
A2: 4000 | B2: 5.9999999999999995E-4 | C2: 5.9999999999999995E-4
A3: =A2*2 -> 8000 | B3: 1E-3 | C3: 1.1999999999999999E-3
A4: =A3*2 -> 16000 | B4: 2.5000000000000001E-3 | C4: 2.5000000000000001E-3
A5: =A4*2 -> 32000 | B5: 5.0000000000000001E-3 | C5: 5.0000000000000001E-3
A6: =A5*2 -> 64000 | B6: 1.2E-2 | C6: 1.7999999999999999E-2
A7: =A6*2 -> 128000 | B7: 0.02 | C7: 0.03
A8: =A7*2 -> 256000 | B8: 0.04 | C8: 0.08
A9: =A8*2 -> 512000 | B9: 0.1 | C9: 0.19
A10: =A9*2 -> 1024000 | B10: 0.18 | C10: 0.46
A11: =A10*2 -> 2048000 | B11: 0.42 | C11: 1.02
A12: =A11*2 -> 4096000 | B12: 1.01 | C12: 2.44
A13: =A12*2 -> 8192000 | B13: 2.31 | C13: 5.32
A14: =A13*2 -> 16384000 | B14: 5.03 | C14: 11.78
A15: =A14*2 -> 32768000 | B15: 10.55 | C15: 26.43